{
	"$schema": "https://raw.githubusercontent.com/CeladonSS13/Shiptest/beta-dev/_maps/_mod_celadon/ship_config_schema.json",
	"map_name": "Tranquility-class Flying Apartment Complex",
	"map_short_name": "Tranquility",
	"description": "Большинство суден имеют четкое назначение - исследовательские, добывающие, грузовые и так далее - но класс 'Tranquility' является заметным исключением из этого правила. 'Tranquility' - довольно спокойное и уравновешенное судно, созданное по образцу традиционных жилых комплексов. Оснащенные несколькими независимыми каютами, большой общей столовой и очень малым количеством промышленного оборудования или средств самообороны, судна класса 'Tranquility' часто можно встретить лениво курсирующими по Фронтиру, устраивающими ситкомовские выходки и отказывающимися от более целенаправленного подхода многих своих современников.",
	"map_path": "_maps/shuttles/independent/independent_tranquility.dmm",
	"enabled": true,
	"limit": 1,
	"sensor_range": 8,
	"prefix": "ЕSV",
	"faction": "/datum/faction/independent",
	"tags": [
		"РП Фокус",
		"Сервисный"
	],
	"namelists": [
		"GENERAL",
		"SPACE",
		"NATURAL"
	],
	"job_slots": {
		"Captain": {
			"outfit": "/datum/outfit/job/cel/independent/captain/western",
			"officer": true,
			"slots": 1
		},
		"Scholar": {
			"outfit": "/datum/outfit/job/cel/independent/curator",
			"slots": 1
		},
		"Medical Tenant": {
			"outfit": "/datum/outfit/job/cel/independent/chemist",
			"slots": 1
		},
		"Engineering Tenant": {
			"outfit": "/datum/outfit/job/cel/independent/engineer",
			"slots": 1
		},
		"Tenant": {
			"outfit": "/datum/outfit/job/cel/independent/curator/dungeonmaster",
			"slots": 1
		},
		"Resident Artist": {
			"outfit": "/datum/outfit/job/cel/independent/assistant/artist",
			"slots": 1
		}
	}
}
