{
	"$schema": "https://raw.githubusercontent.com/CeladonSS13/Shiptest/beta-dev/_maps/_mod_celadon/ship_config_schema.json",
	"map_name": "Osprey-class Exploration Cruiser",
	"map_short_name": "Osprey",
	"description": "Одни из самых современных суден флота Нанотрейзен и престижное задание для их капитанов, знаменитые 'Osprey', участвовавшие в самых драматических астронавигационных столкновениях ICW, продолжают жить в качестве очень хорошо оборудованного исследовательского судна. Прошедшие значительную модернизацию после того, как они стали артиллерийскими платформами Bluespace, современные Osprey используют сенсорное оборудование военного класса и системы искусственного интеллекта для разведки и научной работы. Среди особенностей - хорошо оснащенные медицинские, кулинарные и научные помещения и ядро ИИ, а также общекорабельная система утилизации и доставки и очень вместительный грузовой отсек. Однако мощные (хотя и нестабильные) двигатели на суперматерии, которые приводили в движение первые партии 'Osprey', были вычеркнуты при их реконструкции, а заменяющие их генераторы оставили современные 'Osprey' в состоянии некоторой нехватки энергии. В ЩИТСПАВНЕ ПО ПРИЧИНЕ: Заменен на Целестис!",
	"map_path": "_maps/_modular_solaris/shuttles/nanotrasen/nanotrasen_osprey.dmm",
	"enabled": false,
	"limit": 1,
	"sensor_range": 9,
	"starting_funds": 4000,
	"prefix": "NTRSV",
	"faction": "/datum/faction/nt",
	"tags": ["Исследовательский", "ИИ"],
	"namelists": [
		"NANOTRASEN",
		"SPACE",
		"MYTHOLOGICAL",
		"WEAPONS"
	],
	"job_slots": {
		"Captain": {
			"outfit": "/datum/outfit/job/cel/nanotrasen/captain",
			"officer": true,
			"slots": 1
		},
		"Science Director": {
			"outfit": "/datum/outfit/job/cel/nanotrasen/rd",
			"officer": true,
			"slots": 1
		},
		"Scientist": {
			"outfit": "/datum/outfit/job/cel/nanotrasen/scientist",
			"slots": 2
		},
		"Medical Doctor": {
			"outfit": "/datum/outfit/job/cel/nanotrasen/doctor",
			"slots": 1
		},
		"Paramedic": {
			"outfit": "/datum/outfit/job/cel/nanotrasen/paramedic",
			"slots": 1
		},
		"Engineer": {
			"outfit": "/datum/outfit/job/cel/nanotrasen/engineer",
			"slots": 1
		},
		"Atmospheric Technician": {
			"outfit": "/datum/outfit/job/cel/nanotrasen/atmos",
			"slots": 1
		},
		"Shaft Miner": {
			"outfit": "/datum/outfit/job/cel/nanotrasen/miner",
			"slots": 2
		},
		"Cook": {
			"outfit": "/datum/outfit/job/cel/nanotrasen/cook",
			"slots": 1
		},
		"Assistant": {
			"outfit": "/datum/outfit/job/cel/nanotrasen/assistant",
			"slots": 2
		}
	}
}
