	{
	"$schema": "https://raw.githubusercontent.com/CeladonSS13/Shiptest/beta-dev/_maps/_mod_celadon/ship_config_schema.json",
	"map_name": "Talos-class Command Clipper",
	"map_short_name": "Talos",
	"description": "'Talos' - это судно поддержки и командования, редкий пример специально построенного корабля InteQ. Оснащенные обилием строительного и инженерного оборудования, а также собственным комплексом связи в блюспейсе, способным объединить корабли IRMG в любой системе, 'Talos' часто являются связующим звеном скоординированных операций IRMG в системе и предлагают услуги по строительству и ремонту в качестве части предложения наемников IRMG. Поскольку экипажи 'Talos' делают больший упор на вспомогательный персонал, они, как правило, не так хорошо вооружены по сравнению с другими экипажами InteQ, хоть и обладают мехом с боевым оснащением. Одна из необычных особенностей 'Talos' - 'крылья' с дублирующими перегородками, призванные обеспечить дополнительную прочность в случае ударов или выстрелов. Кроме того, они служат дополнительным местом для хранения вещей и потенциальным местом для модификации корабля предприимчивыми инженерами, которые здесь являются необходимой частью экипажа.",
	"map_path": "_maps/_modular_mankind/shuttles/inteq/inteq_talos.dmm",
	"enabled": true,
	"limit": 1,
	"sensor_range":5,
	"prefix": "IRMV",
	"faction": "/datum/faction/inteq",
	"tags": [
		"Инженерное",
		"Шахтерский",
		"РП Фокус"
	],
	"namelists": [
		"MYTHOLOGICAL",
		"BEASTS",
		"NATURAL_AGGRESSIVE",
		"INTEQ"
	],
	"job_slots": {
		"Vanguard": {
			"outfit": "/datum/outfit/job/cel/inteq/captain",
			"officer": true,
			"slots": 1
		},
		"Master At Arms": {
			"outfit": "/datum/outfit/job/cel/inteq/warden",
			"officer": true,
			"slots": 1
		},
		"Artificer Class II": {
			"outfit": "/datum/outfit/job/cel/inteq/ce",
			"officer": true,
			"slots": 1
		},
		"Artificer": {
			"outfit": "/datum/outfit/job/cel/inteq/engineer",
			"slots": 3
		},
		"Corpsman": {
			"outfit": "/datum/outfit/job/cel/inteq/paramedic",
			"slots": 2
		},
		"Enforcer": {
			"outfit": "/datum/outfit/job/cel/inteq/security",
			"slots": 3
		},
		"Recruit": {
			"outfit": "/datum/outfit/job/cel/inteq/assistant",
			"slots": 2
		}
	}
}
