{
	"$schema": "https://raw.githubusercontent.com/CeladonSS13/Shiptest/beta-dev/_maps/_modular_mankind/ship_config_schema.json",
	"map_name": "Ember-class Pirate Raider",
	"map_short_name": "Ember",
	"description": "Судно класса 'Ember' - это красный флаг в любом секторе. Гигантское, медленно движущееся, опасное в плане безопасности судно, самодельный почти во всех отношениях, пользуется благосклонностью самых безжалостных и жестоких пиратов и негодяев по всей галактике. Простое желание существовать на одном из этих суден - свидетельствует о выносливости, которая обычно не свойственна большинству жителей космоса. Лучший способ иметь дело с суднами 'Ember' - просто обходить их стороной. В ЩИТСПАВНЕ ПО ПРИЧИНЕ: Пираты - Имеет сильное вооружение, является Дредноутом пиратов по типу Твинклшайна или Херона. Для ивентов шип.",
	"map_path": "_maps/_modular_mankind/shuttles/pirate/pirate_ember.dmm",
	"enabled": false,
	"limit": 1,
	"sensor_range": 3,
	"space_spawn": true,
	"prefix": "RSV",
	"faction": "/datum/faction/pirate",
	"tags": [
		"Боевой"
	],
	"namelists": [
		"PIRATES",
		"BRITISH_NAVY"
	],
	"job_slots": {
		"Captain": {
			"outfit": "/datum/outfit/job/cel/pirate/captain",
			"officer": true,
			"slots": 1
		},
		"Bridge Officer": {
			"outfit": "/datum/outfit/job/cel/pirate/hop",
			"officer": true,
			"slots": 2
		},
		"Shipswain": {
			"outfit": "/datum/outfit/job/cel/pirate/hos",
			"officer": true,
			"slots": 1
		},
		"Senior Sapper" :{
			"outfit": "/datum/outfit/job/cel/pirate/frontiersmen/ce",
			"officer": true,
			"slots": 1
		},
		"Cargo Tech": {
			"outfit": "/datum/outfit/job/cel/pirate/frontiersmen/cargo_tech",
			"slots": 2
		},
		"Aidman": {
			"outfit": "/datum/outfit/job/cel/pirate/medic",
			"slots": 1
		},
		"Sapper": {
			"outfit": "/datum/outfit/job/cel/pirate/engineer",
			"slots": 2
		},
		"Atmospheric Technician": {
			"outfit": "/datum/outfit/job/cel/pirate/frontiersmen/atmos",
			"slots": 1
		},
		"Steward": {
			"outfit": "/datum/outfit/job/cel/pirate/cook",
			"slots": 1
		},
		"Boarder": {
			"outfit": "/datum/outfit/job/cel/pirate/security",
			"slots": 3
		},
		"Rookie": {
			"outfit": "/datum/outfit/job/cel/pirate/assistant",
			"slots": 3
		}
	}
}
