{
	"$schema": "https://raw.githubusercontent.com/CeladonSS13/Shiptest/beta-dev/_maps/_modular_solaris/ship_config_schema.json",
	"map_name": "Delta-class Frigate",
	"map_short_name": "Delta",
	"description": "Судно класса 'Delta' - это компактное и современное шахтерское судно, которое дополняет свой сравнительно небольшой органический экипаж полным набором робототехнических средств, включая ИИ и множество шахтерских и логистических дронов и киборгов. Несмотря на то, что Delta очень любимы логистами Нанотрейзен за их минимальное обслуживание и высокую экономическую эффективность, они гораздо менее популярны среди экипажей, выбранных для управления ими, так как им сильно не хватает мест для размещения экипажа и оборонительного вооружения.",
	"map_path": "_maps/_modular_solaris/shuttles/nanotrasen/nanotrasen_delta.dmm",
	"enabled": true,
	"limit": 1,
	"sensor_range": 4,
	"starting_funds": 4000,
	"prefix": "NTDSV",
	"faction": "/datum/faction/nt",
	"tags": [
		"Исследовательский"
	],
	"namelists": [
		"GENERAL",
		"SPACE",
		"BRITISH_NAVY",
		"MERCANTILE",
		"NANOTRASEN"
	],
	"job_slots": {
		"Captain": {
			"outfit": "/datum/outfit/job/cel/nanotrasen/captain",
			"officer": true,
			"slots": 1
		},
		"Science Director": {
			"outfit": "/datum/outfit/job/cel/nanotrasen/rd",
			"officer": true,
			"slots": 1
		},
		"Roboticist": {
			"outfit": "/datum/outfit/job/cel/nanotrasen/scientist/deforest_researcher/roboticist",
			"slots": 2
		},
		"Mining Mech Pilot": {
			"outfit": "/datum/outfit/job/cel/nanotrasen/miner",
			"slots": 1
		},
		"Engineer": {
			"outfit": "/datum/outfit/job/cel/nanotrasen/engineer",
			"slots": 1
		},
		"Assistant": {
			"outfit": "/datum/outfit/job/cel/nanotrasen/assistant",
			"slots": 1
		}
	}
}
