{
	"$schema": "https://raw.githubusercontent.com/CeladonSS13/Shiptest/beta-dev/_maps/_modular_mankind/ship_config_schema.json",
	"map_name": "Slasher-class ESW Vessel",
	"map_short_name": "Slasher",
	"description": "'Slasher' - новейший корабль раннего предупреждения Нанотрейзен, разработанный специально для дальней разведки своими мощнейшими сенсорами. Его выделяет огромная площадь покрытия солнечных панелей, ранее упомянутая дальность сенсоров, высокая удельная тяга, а также малый экипаж и достойная его квалификация - корабли обычно отдаются во власть Отдела по предотвращению потерь активов.",
	"map_path": "_maps/_modular_mankind/shuttles/nanotrasen/nanotrasen_slasher.dmm",
	"sensor_range": 8,
	"enabled": true,
	"limit": 1,
	"prefix": "NTBSV",
	"faction": "/datum/faction/nt",
	"tags": [
		"Боевой"
	],
	"namelists": [
		"NANOTRASEN",
		"BRITISH_NAVY"
	],
	"job_slots": {
		"Intelligence Officer": {
			"outfit": "/datum/outfit/job/cel/nanotrasen/intel/captain",
			"officer": true,
			"slots": 1
		},
		"Security Operative": {
			"outfit": "/datum/outfit/job/cel/nanotrasen/intel/operative",
			"slots": 1
		},
		"Medical Technician": {
			"outfit": "/datum/outfit/job/cel/nanotrasen/intel/medic",
			"slots": 1
		},
		"Engineering Technician": {
			"outfit": "/datum/outfit/job/cel/nanotrasen/intel/engineer",
			"slots": 1
		}
	}
}
