{
	"$schema": "https://raw.githubusercontent.com/CeladonSS13/Shiptest/beta-dev/_maps/_mod_celadon/ship_config_schema.json",
	"map_name": "Halftrack-class Merchant Vessel",
	"map_short_name": "Halftrack",
	"description": "Редкое явление в Приграничье (но желанное), судно класса Halftrack - это сильно модернизированный вариант спасательного судна класса Li Tieguai, используемое в качестве передвижного магазина огнестрельного оружия предприимчивыми торговцами оружием повсюду. Если первоначальные варианты судна были скорее просто 'Li Tieguai', а медицинские приспособления были удалены и заменены оружейными стойками и шкафами для боеприпасов, то современная версия 'Halftrack' оснащена стрельбищем, сертифицированной службой безопасности InteQ и централизованным торговым залом, идеальным для демонстрации товаров и одновременного обеспечения их безопасности. В ЩИТСПАВНЕ ПО ПРИЧИНЕ: ШИП НАХОДИТЬСЯ НА ДОРАБОТКЕ БАЛАНСА! Оутфиты сломаны!",
	"map_path": "_maps/_modular_solaris/shuttles/independent/independent_halftrack.dmm",
	"enabled": false,
	"limit": 1,
	"sensor_range": 4,
	"prefix": "ISV",
	"faction": "/datum/faction/independent",
	"tags": [
	"Торговый",
	"РП Фокус"
	],
	"job_slots": {
		"Captain": {
			"outfit": "/datum/outfit/job/cel/independent/captain",
			"slots": 1
		},
		"IRMG Vanguard": {
			"outfit": "/datum/outfit/job/inteq/captain",
			"officer": true,
			"slots": 1
		},
		"IRMG Enforcer": {
			"outfit": "/datum/outfit/job/inteq/security",
			"slots": 2
		}
	}
}
