{
	"$schema": "https://raw.githubusercontent.com/CeladonSS13/Shiptest/beta-dev/_maps/_mod_celadon/ship_config_schema.json",
	"map_name": "Junker-class Salvaged Ship",
	"map_short_name": "Junker",
	"description": "Судно класса 'Junker' - это не официальный класс, а скорее название общей группы суден, созданных из руин старых суден или станций. Эти судна стали обычным явлением во время ICW, когда дезертиры бежали из зон конфликта на этих 'Junker's', не готовые к трудностям космической жизни. С тех пор они стали редкостью, а немногие выжившие экипажи этих суден обычно испытывают чувство презрения к обычным властным структурам и, как правило, не имеют определенного капитана или даже владельца судна.",
	"map_path": "_maps/shuttles/independent/independent_junker.dmm",
	"enabled": true,
	"limit": 1,
	"sensor_range": 7,
	"starting_funds": 0,
	"prefix": "SV",
	"faction": "/datum/faction/independent",
	"tags": ["Выживание"],
	"namelists": [
		"GENERAL",
		"SPACE"
	],
	"job_slots": {
		"Assistant": {
			"outfit": "/datum/outfit/job/cel/independent/assistant",
			"slots": 4
		}
	}
}
