{
	"$schema": "https://raw.githubusercontent.com/CeladonSS13/Shiptest/beta-dev/_maps/_modular_mankind/ship_config_schema.json",
	"map_name": "Venture-class Exploration Shuttle",
	"map_short_name": "Venture",
	"description": "Небольшой шахтерский шатл для поддержки флота. Создан для обслуживания и технической поддержки более крупных судов. Данный экземпляр производства Нанотрейзен. Расчитан для кофмортной работы экипажа из двух человек.",
	"map_path": "_maps/_modular_mankind/shuttles/nanotrasen/nanotrasen_venture.dmm",
	"enabled": true,
	"limit": 1,
	"sensor_range": 4,
	"starting_funds": 2000,
	"prefix": "NTDSV",
	"faction": "/datum/faction/nt",
	"tags": ["Шахтерский"],
	"namelists": ["NANOTRASEN"],
	"job_slots": {
		"Captain": {
			"outfit": "/datum/outfit/job/cel/nanotrasen/captain/nslogistics",
			"officer": true,
			"slots": 1
		},
		"Assistant": {
			"outfit": "/datum/outfit/job/cel/nanotrasen/assistant/nslogistics",
			"slots": 1
		}
	}
}
