{
	"$schema": "https://raw.githubusercontent.com/CeladonSS13/Shiptest/beta-dev/_maps/_modular_mankind/ship_config_schema.json",
	"map_name": "Luxembourg-class Delivery Vessel",
	"map_short_name": "Luxembourg",
	"description": "Судно двойного назначения: доставка и продажа. Судно класса 'Luxembourg' составляет значительную часть флота Donk! Co. на границе, где вечно-оппортунистская корпорация начала заполнять пробелы, оставшиеся после краха логистической сети Nanotrasen. Менеджеры Donk! Co. обладают большой степенью автономии, и поэтому в любом конкретном корабле 'Luxembourg' часто приходится вносить существенные изменения в торговый зал и бортовое кафе, чтобы лучше привлекать новых клиентов в нестабильном, но прибыльном регионе пространства.",
	"map_path": "_maps/_modular_mankind/shuttles/syndicate/syndicate_luxembourg.dmm",
	"enabled": true,
	"limit": 1,
	"sensor_range": 3,
	"starting_funds": 6000,
	"prefix": "TSSV",
	"faction": "/datum/faction/syndicate",
	"tags": ["Торговый", "РП Фокус"],
	"namelists": [
		"DONK",
		"MERCANTILE",
		"SPACE"
	],
	"job_slots": {
		"Manager": {
			"outfit": "/datum/outfit/job/cel/syndicate/quartermaster/donk",
			"slots": 1
		},
		"Customer Service Representative": {
			"outfit": "/datum/outfit/job/cel/syndicate/cargo_tech/donk",
			"slots": 5
		},
		"Food and Beverage Specialist": {
			"outfit": "/datum/outfit/job/cel/syndicate/bartender",
			"slots": 1
		},
		"GEC Contracted Engineer": {
			"outfit": "/datum/outfit/job/cel/syndicate/engineer/gec",
			"slots": 1
		}
	}
}
