{
	"$schema": "https://raw.githubusercontent.com/CeladonSS13/Shiptest/beta-dev/_maps/_modular_solaris/ship_config_schema.json",
	"map_name": "Howler-class easy Warship ",
	"map_short_name": "Howl",
	"description": " «Howl» — созданный корабль на...",
	"map_path": "_maps/shuttles/syndicate/syndicate_gorlex_howl.dmm",
	"enabled" : true,
	"limit": 1,
	"sensor_range": 7,
	"faction": "/datum/faction/syndicate",
	"prefix": "BSSV",
	"tags": [
		"Боевой"
	],
	"namelists": [
		"GORLEX",
		"NATURAL_AGGRESSIVE",
		"BEASTS",
		"WEAPONS",
		"ACLF"
	],
	"job_slots": {
		"Commander": {
			"outfit": "/datum/outfit/job/cel/syndicate/captain",
			"officer": true,
			"slots": 1
		},
		"Hardliner Consultant": {
			"outfit": "/datum/outfit/job/cel/syndicate/captain/gorlex",
			"officer": true,
			"slots": 1
		},
		"hardliner Operatives": {
			"outfit": "/datum/outfit/job/cel/syndicate/security/gorlex",
			"slots": 2
		},
		"Combat Medic": {
			"outfit": "/datum/outfit/job/cel/syndicate/doctor",
			"slots": 1
		},
		"Combat Mechanic": {
			"outfit": "/datum/outfit/job/cel/syndicate/engineer",
			"slots": 1
		}
	}
}
