{
	"$schema": "https://raw.githubusercontent.com/CeladonSS13/Shiptest/beta-dev/_maps/_modular_solaris/ship_config_schema.json",
	"map_name": "Beetle-class Battle Schnau",
	"map_short_name": "Beetle",
	"description": "Боевое судно класса Beetle- Небольшое судно используемое Горлексом для поддержки в бою или мелких рейдах. Было разработано при поддержке киберсан для создания манёвренного судна для быстрых операций, в качестве эксперимента экипаж был оснащён лазерным вооружением.",
	"map_path": "_maps/_modular_solaris/shuttles/syndicate/syndicate_gorlex_beetle.dmm",
	"enabled": true,
	"limit": 1,
	"sensor_range": 4,
	"prefix": "BSSV",
	"faction": "/datum/faction/syndicate",
	"tags": ["Боевой"],
	"namelists": [
		"GORLEX",
		"NATURAL_AGGRESSIVE",
		"BEASTS",
		"WEAPONS",
		"ACLF"
	],
	"job_slots": {
		"Squad leader": {
			"outfit": "/datum/outfit/job/cel/syndicate/captain/gorlex",
			"officer": true,
			"slots": 1,
			"name": "Gorlex Squad leader"
		},
		"Paramedic": {
			"outfit": "/datum/outfit/job/cel/syndicate/doctor/gorlex",
			"slots": 1,
			"name": "Paramedic"
		},
		"Mechanic": {
			"outfit": "/datum/outfit/job/cel/syndicate/engineer/gorlex",
			"slots": 1

		},
		"Operative": {
			"outfit": "/datum/outfit/job/cel/syndicate/security/gorlex",
			"slots": 3
		}
	}
}
