{
	"$schema": "https://raw.githubusercontent.com/CeladonSS13/Shiptest/beta-dev/_maps/_mod_celadon/ship_config_schema.json",
	"map_name": "Savior-class multifunctional medical ship",
	"map_short_name": "Savior",
	"description": "Многофункциональное медицинское судно класса 'Savior' является одной из новейших разработок компании Nanotrasen. Оно спроектировано для оказания всесторонней медицинской помощи в условиях космоса. Судно оснащено современным медицинским оборудованием и системами жизнеобеспечения, что позволяет оперативно и эффективно реагировать на различные медицинские чрезвычайные ситуации. Благодаря своей универсальности, судно 'Savior' может использоваться как для спасательных операций, так и для проведения длительных медицинских экспедиций.",
	"map_path": "_maps/shuttles/nanotrasen/nanotrasen_savior.dmm",
	"enabled": true,
	"limit": 1,
	"sensor_range": 9,
	"prefix": "NTMSV",
	"faction": "/datum/faction/nt",
	"tags": [
		"Исследовательский",
		"Медицинское"
	],
	"namelists": [
		"GENERAL",
		"SPACE",
		"NANOTRASEN"
	],
	"job_slots": {
		"Medical Director": {
			"outfit": "/datum/outfit/job/cel/nanotrasen/captain/deforest_captain",
			"officer": true,
			"slots": 1
		},
		"Engineer": {
			"outfit": "/datum/outfit/job/cel/nanotrasen/engineer/nakamura",
			"slots": 1
		},
		"Medical Doctor": {
			"outfit": "/datum/outfit/job/cel/nanotrasen/doctor/deforest_medic",
			"slots": 2
		},
		"Chemist": {
			"outfit": "/datum/outfit/job/cel/nanotrasen/chemist/deforest_chemist",
			"slots": 1
		},
		"Genetical Researcher": {
			"outfit": "/datum/outfit/job/cel/nanotrasen/scientist/deforest_researcher/genetic",
			"slots": 1
		},
		"Paramedic": {
			"outfit": "/datum/outfit/job/cel/nanotrasen/paramedic/deforest_medic",
			"slots": 1
		}
	}
}
