{
	"$schema": "https://raw.githubusercontent.com/CeladonSS13/Shiptest/beta-dev/_maps/_mod_celadon/ship_config_schema.json",
	"map_name": "Rondo-class Renegade Assault Vessel",
	"map_short_name": "Rondo",
	"description": "'Rondo' - Cудно ранее используемое синдикатом как разведывательное, изначально снабжалось системой оптического камуфляжа. Однако из-за несовершенства технологии, любое повреждение экранирования приводило к полному отключению систем, в связи с чем судну требовался длительный ремонт. Ко всему прочему, использование технологии оптического камуфляжа, а тем более его ремонт требовали высокую степень квалификации экипажа, в результате чего система камуфляжа была снята, а сами суда из-за своей малой эффективности отправлены на утилизацию в верфи конструкторского бюро. От полного уничтожения данные суда были спасены во время рейда группировкой Рамзи, благодаря чему некоторые экземпляры попали на черный рынок, а оставшиеся до сих пор находятся во владении некоторых боевых формирований, в том числе и Ренегатов.",
	"map_path": "_maps/_modular_mankind/shuttles/pirate/pirate_rondo.dmm",
	"enabled" : true,
	"limit": 1,
	"sensor_range": 13,
	"space_spawn": true,
	"prefix": "RSV",
	"faction": "/datum/faction/pirate",
	"tags": [
		"Боевой",
		"Выживание"
	],
	"namelists": [
		"PIRATES",
		"NATURAL_AGGRESSIVE"
	],
	"job_slots": {
		"Battle Master": {
			"outfit": "/datum/outfit/job/cel/pirate/ramzi/captain",
			"officer": true,
			"slots": 1
		},
		"Commando": {
			"outfit": "/datum/outfit/job/cel/pirate/ramzi/trooper",
			"slots": 4
		}
	}
}
