{
	"$schema": "https://raw.githubusercontent.com/CeladonSS13/Shiptest/beta-dev/_maps/ship_config_schema.json",
	"map_name": "Libertatia-class Hauler",
	"map_short_name": "Libertatia",
	"description": "Широкодоступный и дешевый курьерское судно компании Miskilamo Spacefaring 'Libertatia' представляет собой некачественный ремонт старых гражданских атмосферных суден или сгоревших обломков других 'Libertatia', которые становятся номинально пригодными для космоса и способны перевозить скромный груз на огромных скоростях. Хотя Libertatia продавалась как курьерское судно и грузовой шаттл малой дальности, её истинным рынком сбыта стали контрабандисты, блокадники и пираты, которые нашли ее скорость и низкую цену - чрезвычайно привлекательными. В последние годы пираты стали гораздо чаще управлять 'Libertatias', чем кто-либо другой. Данная же 'Libertatia' попала в руки пиратов - абордажников, специализирующихся на нелетальном захвате целей, с их последующей перепродажей или в качестве рычагов давления на конкурентов.",
	"map_path": "_maps/shuttles/pirate/pirate_libertatia.dmm",
	"enabled": true,
	"limit": 1,
	"sensor_range": 8,
	"space_spawn": true,
	"prefix": "RSV",
	"faction": "/datum/faction/pirate",
	"tags": [
		"Специализированный",
		"Боевой"
	],
	"namelists": [
		"PIRATES",
		"NATURAL_AGGRESSIVE"
	],
	"job_slots": {
		"Captain": {
			"outfit": "/datum/outfit/job/cel/pirate/captain",
			"officer": true,
			"slots": 1
		},
		"Buccaneer": {
			"outfit": "/datum/outfit/job/cel/pirate/security",
			"slots": 2
		},
		"Motorman": {
			"outfit": "/datum/outfit/job/cel/pirate/engineer",
			"slots": 1
		},
		"Ship's Doctor": {
			"outfit": "/datum/outfit/job/cel/pirate/medic",
			"slots": 1
		},
		"Deckhand": {
			"outfit": "/datum/outfit/job/cel/pirate/assistant",
			"slots": 2
		}
	}
}
