{
	"$schema": "https://raw.githubusercontent.com/CeladonSS13/Shiptest/beta-dev/_maps/_mod_celadon/ship_config_schema.json",
	"map_name": "Aldaama-class Experimental Project",
	"map_short_name": "Aldaama",
	"description": "Изначально 'Алдаама' работал на двигателе Сингулярности, но после ее побега, никто даже не заикался снова ввести ее в эксплуатацию. Вместо этого сделали более безопасный двигатель Тесла. На данный момент у Республики Элизиума всего два таких корабля. Один стоит в музее 'Алехар'(каменистая планета 'Лер'), а второй активно используется сепаратистами Элизиума как корабль снабжения и оперативной телекоммуникационной базой.",
	"map_path": "_maps/shuttles/elysium/elysium_aldaama.dmm",
	"enabled": true,
	"limit": 1,
	"sensor_range": 4,
	"prefix": "ESV",
	"faction": "/datum/faction/elysium",
	"tags": [
		"Специализированный",
		"Боевой",
		"РП Фокус"
	],
	"namelists": [
		"SPACE",
		"WEAPONS",
		"ENGINEERING"
	],
	"job_slots": {
		"Caid": {
			"outfit": "/datum/outfit/job/cel/elysium/captain",
			"officer": true,
			"slots": 1
		},
		"Ahisa`i": {
			"outfit": "/datum/outfit/job/cel/elysium/assistant",
			"slots": 3
		},
		"Mukatell": {
			"outfit": "/datum/outfit/job/cel/elysium/security",
			"slots" : 2
		}
	}
}
