{
	"$schema": "https://raw.githubusercontent.com/CeladonSS13/Shiptest/beta-dev/_maps/_mod_celadon/ship_config_schema.json",
	"map_name": "Rube Goldberg-class Engineering Project",
	"map_short_name": "Rube-Goldberg",
	"description": "Инженерный проект класса 'Rube Goldberg' - это опыт и памятник безумию. Мощный двигатель из сверхматерии в сочетании с эшеровской конструкцией, сложной сетью труб и проводов и полным пренебрежением к элементарным процедурам безопасности и здравому смыслу делают это судно катастрофой, которая только и ждет, чтобы случиться. В ЩИТСПАВНЕ ПО ПРИЧИНЕ: В щитспавне по причине: Очень сложный экперементальный шип, спавнить только на свой страх и риск!",
	"map_path": "_maps/_modular_solaris/shuttles/independent/independent_rube_goldberg.dmm",
	"enabled": false,
	"limit": 1,
	"sensor_range": 4,
	"prefix": "ISV",
	"faction": "/datum/faction/independent",
	"tags": ["Инженерный"],
	"namelists": [
		"GENERAL",
		"ENGINEERING"
	],
	"job_slots": {
		"Chief at Engineering": {
			"outfit": "/datum/outfit/job/cel/independent/ce",
			"officer": true,
			"slots": 1
		},
		"Chief at Boozineering": {
			"outfit": "/datum/outfit/job/cel/independent/bartender",
			"slots": 1
		},
		"Engineering Specialist": {
			"outfit": "/datum/outfit/job/cel/independent/engineer",
			"slots": 2
		},
		"Atmospheric Specialist": {
			"outfit": "/datum/outfit/job/cel/independent/atmos",
			"slots": 2
		},
		"Medical Specialist": {
			"outfit": "/datum/outfit/job/cel/independent/doctor",
			"slots": 1
		},
		"Mining Specialist": {
			"outfit": "/datum/outfit/job/cel/independent/miner",
			"slots": 2
		}
	}
}
